{"timestamp":"2026-08-05T10:44:17+00:00","stage":"multisource_semantic_v3_large_build","hypothesis":"Three offline synthetic sources can be normalized under one frozen Llama-3.1-70B victim contract while preserving deterministic exact transitions, complete InjecAgent pairs, and zero real endpoint use.","parent_commit":"06b038f","candidate_commit":"4d73886","protocol_sha256":"78473c00ac014d9ec904dc18654f52c28acd42313002a8701f1bb5144364cb70","dataset_sha256":"9a930150e70c718c9ceb72d119212f485358897487e3a683c123e8725707ba1d","job_ids":{"generation_array":6354,"cancelled_summary":6355,"label_blind_recovery_and_summary":6374},"elapsed":{"generation_array_wall_interval":"01:33:13","recovery_and_summary":"00:01:06"},"resources":{"generation":"21 one-GPU shards, max concurrency 4, 8 CPU and 96 GB RAM per shard","recovery":"CPU-only, 8 CPU and 48 GB RAM"},"metrics":{"rows":2367,"source_counts":{"tool_sandbox":95,"injecagent":2108,"tau3":164},"runtime_failures":0,"exact_executions":152,"nondeterministic_exact_executions":0,"injecagent_complete_pairs":1054,"clean_attacker_tool_rate":0.003795066413662239,"poisoned_attacker_tool_rate":0.12903225806451613,"real_external_endpoint_calls":0},"gate_clauses":{"all_source_gates_pass":true,"all_three_sources_present":true,"unique_row_ids":true,"single_frozen_llm_contract":true,"zero_real_external_endpoint_calls":true},"status":"keep","interpretation":"Large v1 passed after a label-blind repair that moved pair completeness from invalid shard-local scope to the frozen merged-data scope. No completion was regenerated and no extra LLM call was made; one audit-stage traceback is retained as orchestration counterevidence."}
{"timestamp":"2026-08-05T13:10:34+00:00","stage":"tau3_multistep_scale_readiness_v1","hypothesis":"Action-balanced tau3 tasks collected as adjacent exact one-agent trajectories provide enough changed and unchanged transitions to authorize the frozen observation-aware Markov comparison.","parent_commit":"39773fa","candidate_commit":"cdb5077","protocol_sha256":"b791b01996988081ee30426d9c31ee9761337ca7fb42b76e00aac79caf4a1551","dataset_sha256":"9973ec2d1756e441b30f1ad03b2452a524f6e8e3d5678386f4ddfef4bb865acc","job_ids":{"generation_array":6404,"summary":6405},"elapsed":{"first_completed_chunk":"2026-08-05T12:39+00:00","final_summary":"2026-08-05T13:10:34+00:00"},"resources":{"generation":"6 one-GPU shards, max concurrency 4, 8 CPU and 96 GB RAM per shard","summary":"CPU-only, 4 CPU and 32 GB RAM"},"metrics":{"episodes":96,"prefixes":259,"adjacent_transitions":163,"episodes_with_two_or_more_transitions":46,"tasks_with_at_least_one_transition":42,"unique_executed_tools":19,"tool_decision_rate":0.6525096525096525,"dominant_action_fraction":0.12355212355212356,"state_changed_transitions":5,"state_unchanged_transitions":158,"runtime_failures":0,"nondeterministic_transitions":0,"real_external_endpoint_calls":0},"gate_clauses":{"all_integrity_checks":true,"minimum_adjacent_transitions":true,"minimum_multistep_episodes":true,"minimum_task_and_tool_coverage":true,"action_balance":true,"minimum_state_changed_transitions":false,"minimum_state_unchanged_transitions":true,"minimum_supported_transition_targets":true},"status":"discard","interpretation":"The data form repaired the zero-adjacent-transition defect but failed the sole state-change gate (5 < 15); no method training or scaling was authorized. Post-gate source audit additionally found that v1 omitted the official user simulator and exposed UserScenario to the agent, motivating a separate interaction-faithful candidate rather than threshold relaxation."}
{"timestamp":"2026-08-06T08:03:36+00:00","stage":"tau3_interaction_faithful_repair_v1","hypothesis":"Restoring official half-duplex user-agent-environment interaction with one shared frozen Llama-3.1-70B instance recovers enough assistant-side state-changing support to authorize the frozen predictive-method comparison.","parent_commit":"cdb5077","candidate_commit":"f53bc5f7fad76ade08f6e7675ea8005178908127","protocol_sha256":"6cae3ea5583dba82a62713163e89d845791184c5d405943e31d5448bfac8e641","dataset_sha256":"c1d3aaca520d82da4d1cf69247f47ce25d77150840b3b9ac9c1893241a79c631","gate_sha256":"cf6ce03a9b5399ef6ab856153b997297934c052efb9271c70e126de549d70afd","job_ids":{"generation_array":6457,"summary":6532},"metrics":{"episodes":96,"natural_user_messages":510,"adjacent_assistant_tool_transitions":254,"forced_budget_stop_episodes":78,"state_changed_assistant_transitions":1,"state_unchanged_assistant_transitions":253,"tasks_with_state_change":1,"domains_with_state_change":1,"paired_state_change_gain":-4,"supported_transition_targets":3,"assistant_tool_errors":79,"runtime_failures":0,"nondeterministic_tool_events":0,"real_external_endpoint_calls":0},"failed_gate_clauses":["forced_budget_stop_episodes","state_changed_assistant_transitions","tasks_with_state_changed_assistant_transition","domains_with_state_changed_assistant_transition","paired_state_changed_transition_gain_over_parent","supported_transition_targets"],"status":"discard","interpretation":"Turn-taking fidelity and coverage improved, but 78 episodes hit a hard role horizon and assistant mutations regressed from five to one. User-side mutations are retained as exogenous counterevidence, not relabeled to rescue the frozen gate. No method test or scale-up is authorized; a label-blind 24-episode horizon-only pilot is preregistered."}
{"timestamp":"2026-08-06T10:55:15+00:00","stage":"tau3_horizon_extension_pilot_v1","hypothesis":"A label-blind 16/16 role-call horizon with a coherent 64-step orchestrator reduces paired truncation and recovers assistant-side state-changing transition support without changing the model, prompts, tools, parser, or target contract.","parent_commit":"69e23927f57e444befc77a92ebda367e1c3aac8d","candidate_commit":"69e23927f57e444befc77a92ebda367e1c3aac8d","protocol_sha256":"537e5221236cc1f93e86ab6550f2d1a3cb01cfd30ac24589be3e948e82d32d69","dataset_sha256":"23e368d8185b8ca8db151f3cf9b831cdca594d05c3c73b062fa2836353799327","gate_sha256":"4e870450406a1c4a32f6cdfc4ab5b0ed416cccb29f6528a918e333c4a74c4048","job_ids":{"generation_array":6534,"summary":6535},"metrics":{"episodes":24,"adjacent_assistant_tool_transitions":103,"forced_budget_stop_episodes":5,"parent_forced_budget_stop_episodes":18,"relative_forced_stop_reduction":0.7222222222222222,"state_changed_assistant_transitions":10,"state_unchanged_assistant_transitions":93,"tasks_with_state_change":6,"domains_with_state_change":2,"paired_state_change_gain":9,"supported_transition_targets":4,"assistant_tool_error_rate":0.22330097087378642,"parent_assistant_tool_error_rate":0.25675675675675674,"parent_prefix_mismatches":0,"runtime_failures":0,"nondeterministic_tool_events":0,"real_external_endpoint_calls":0},"gate_clauses":{"all_preregistered_clauses":true,"all_integrity_checks":true},"status":"keep","interpretation":"The horizon-only intervention passed every pilot clause and recovered a strong paired two-domain mutation signal while reducing forced stops by 72.22%. Telecom remained mutation-free and output_nonempty remained unsupported, so only an identical-contract 96-episode confirmation is authorized; method training and scale-up remain forbidden."}
{"timestamp":"2026-08-07T04:22:08+00:00","stage":"tau3_horizon_confirmation_v1","hypothesis":"The passed 16/16-role, 64-step horizon mechanism reproduces over all 96 interaction-v1 episodes, including 72 out-of-pilot episodes, while satisfying the original full-data sufficiency gate.","parent_commit":"69e23927f57e444befc77a92ebda367e1c3aac8d","candidate_commit":"1750af88683c13e969fecfd6e2e386f4810c2173","protocol_sha256":"6eef4d484095deba86ff6777a314bd05d931467bcb21542a4a8678df5a5a66cc","manifest_sha256":"bea0961bcd1208af3df41057bf27826a94ceef0e77c28f6f3cc691472c034ea8","dataset_sha256":"6d570ca8fc3ab7d556fa3faf4e470c6f326fdbcf59d6f7e686929f7856134498","dataset_audit_sha256":"3b4ede0d31d38e7970511ecf94ecc3554ebd7eba9f145bd0774c4fbc4c03193c","gate_sha256":"d4936d31edcee855a0be42ae75f9e673616c85ff4a344a87d94cbfc1452d8521","job_ids":{"generation_array":6565,"summary":6568},"job_exit_evidence":{"slurm_accounting_storage":"disabled","generation_completion_sentinels":6,"passing_chunk_audits":6,"summary_afterok_dependency":"afterok:6565","summary_completion_sentinel":true,"fatal_log_signatures":0},"metrics":{"episodes":96,"forced_budget_stop_episodes":26,"parent_forced_budget_stop_episodes":78,"relative_forced_stop_reduction":0.6666666666666666,"adjacent_assistant_tool_transitions":367,"agent_tool_decision_rate":0.33454876937101186,"state_changed_assistant_transitions":21,"state_unchanged_assistant_transitions":346,"tasks_with_state_change":11,"domains_with_state_change":2,"paired_state_change_gain":20,"supported_transition_targets":4,"assistant_tool_error_rate":0.24795640326975477,"parent_assistant_tool_error_rate":0.3110236220472441,"out_of_pilot_state_changed_assistant_transitions":11,"out_of_pilot_tasks_with_state_change":5,"out_of_pilot_domains_with_state_change":2,"parent_prefix_mismatches":0,"raw_pilot_overlap_reproduced":0,"runtime_failures":0,"nondeterministic_tool_events":0,"real_external_endpoint_calls":0},"failed_gate_clauses":["forced_budget_stop_episodes","minimum_agent_tool_decision_rate","pilot_overlap_reproducibility","integrity::all_pilot_overlap_episodes_reproduced"],"post_gate_counterevidence":{"pilot_overlap_agent_decisions_identical":24,"pilot_overlap_user_generations_identical":24,"only_observed_raw_difference":"trajectory[*].timestamp","current_decision_recomputed":false,"telecom_assistant_tool_events":8,"telecom_user_tool_events":44,"user_tool_events_relabelled":false},"status":"discard","interpretation":"The full confirmation preserved strong two-domain assistant mutation support and passed every safety, replay, holdout, support, and error-rate clause, but exceeded the forced-stop ceiling by two episodes and missed the agent tool-decision floor by 1.55 percentage points. Raw overlap identity also failed on runtime timestamps; the post-gate diagnosis is preserved and does not rescue the binding NO-GO. No method test or scale-up is authorized; only a 20/20-role, 80-step label-blind tail pilot is preregistered without submission."}
{"timestamp":"2026-08-11T05:25:53+00:00","stage":"tau3_tail_horizon_pilot_v1","hypothesis":"A 20/20-role, 80-step horizon repairs the remaining truncation and assistant-side transition support defects without changing the model, protocol, parser, tools, or targets.","parent_commit":"1750af88683c13e969fecfd6e2e386f4810c2173","candidate_commit":"2e09ee3a6679ab0969c3cb966bdf6a81bb6f0676","gate_sha256":"219d4bee003b844989fc51fc2b92cbe3d7eb972582473c3ee840a8ec8ad1a0c5","job_ids":{"generation_array":6657,"summary":6658},"metrics":{"episodes":24,"forced_budget_stop_episodes":4,"parent_forced_budget_stop_episodes":8,"relative_forced_stop_reduction":0.5,"natural_user_messages":205,"adjacent_assistant_tool_transitions":87,"agent_tool_decision_rate":0.3010380623,"state_changed_assistant_transitions":1,"state_unchanged_assistant_transitions":86,"tasks_with_state_change":1,"domains_with_state_change":1,"paired_state_change_gain":0,"supported_transition_targets":3,"runtime_failures":0,"real_external_endpoint_calls":0},"failed_gate_clauses":["agent_tool_rate_floor","changed_domains","changed_tasks","changed_transitions","paired_change_gain","supported_targets"],"status":"discard","interpretation":"The longer tail reduced truncation but failed six frozen assistant-transition sufficiency clauses. Horizon extension alone is rejected; no 96-episode confirmation or tau3 scale-up is authorized, and any future candidate must model joint user-agent dynamics."}
{"timestamp":"2026-08-11T21:09:54+00:00","stage":"toolsandbox_injecagent_multiseed_replication_v1","hypothesis":"Two additional frozen Llama-3.1-70B seeds provide a complete auxiliary stochastic-response surface for ToolSandbox and InjecAgent under a one-GPU-at-a-time budget.","parent_commit":"31a06f8375271e0b669e8264fb47411ffebf18bd","candidate_commit":"5d4041032ff054fd78df2d3c747a23b01b56413c","protocol_sha256":"c942219ba33e43aac0055ba313fe67f1a8bffe989058226407a7d3d82b93c598","dataset_sha256":"396e3ea67e831ac4ac5ee117422be722f5189cb498df4cb102af7f5b5a1ad14d","gate_sha256":"26807040d9a5bf3fc039e58afb810986efbe9f26ca6b3f37e763dc0f6b3082d3","job_ids":{"tool_sandbox":6659,"injecagent_array":6660,"failed_recovery_preflight":6683,"toolsandbox_recovery":6685,"summary":6686},"resources":{"maximum_concurrent_gpus":1,"toolsandbox_recovery":"CPU-only, 186 exact replays, zero LLM calls"},"metrics":{"rows":4406,"tool_sandbox_rows":190,"injecagent_rows":4216,"injecagent_complete_pairs":2108,"tool_sandbox_tool_calls":93,"injecagent_tool_calls":2149,"original_raw_replica_mismatches":4,"canonical_replica_mismatches":0,"poisoned_minus_clean_attacker_tool_rate":0.2030360531309298,"runtime_failures":0,"real_external_endpoint_calls":0},"gate_clauses":{"all_preregistered_completion_and_integrity_checks":true,"original_toolsandbox_failure_preserved":true,"separate_measurement_recovery_passed":true},"status":"keep","interpretation":"The 4,406-row auxiliary expansion passed after a separately preregistered representation-level recovery reproduced all four raw ToolSandbox mismatches and showed they consisted only of Python memory addresses or replay-generated UUIDs. Original failed evidence remains immutable. The extra seeds improve probability estimation but add no independent tasks and do not overturn the scale NO-GO or authorize Dreamer training."}
